{
 "schema": "lsv-fuel-vessel/1",
 "vessel": {
  "name": "DEMO BARGE (fictional)",
  "class": "Fictional test data"
 },
 "distributionMarking": "FICTIONAL DEMO DATA - not a real vessel. Do not use for operations.",
 "source": {
  "note": "Made-up numbers for trying the app."
 },
 "constants": {
  "densityLbPerGal": 7.1,
  "waterLbPerGal": 8.345,
  "litersPerGal": 3.785411784,
  "trimVesselLengthFt": 100,
  "trimTankLengthFt": 20,
  "trimDivisor": 2,
  "trimSign": "stern-minus-bow",
  "fuelTotalFillLimitPct": 90,
  "lookup": "floor"
 },
 "tanks": [
  {
   "id": "F1",
   "name": "Fuel tank 1 (demo)",
   "type": "fuel",
   "capacityGal": 1200,
   "fillLimitPct": 90,
   "unpumpableGal": 20,
   "trimCorrected": false,
   "stepIn": 0.25,
   "maxIn": 48,
   "sumGroup": null,
   "gallons": [
    0.0,
    6.25,
    12.5,
    18.75,
    25.0,
    31.25,
    37.5,
    43.75,
    50.0,
    56.25,
    62.5,
    68.75,
    75.0,
    81.25,
    87.5,
    93.75,
    100.0,
    106.25,
    112.5,
    118.75,
    125.0,
    131.25,
    137.5,
    143.75,
    150.0,
    156.25,
    162.5,
    168.75,
    175.0,
    181.25,
    187.5,
    193.75,
    200.0,
    206.25,
    212.5,
    218.75,
    225.0,
    231.25,
    237.5,
    243.75,
    250.0,
    256.25,
    262.5,
    268.75,
    275.0,
    281.25,
    287.5,
    293.75,
    300.0,
    306.25,
    312.5,
    318.75,
    325.0,
    331.25,
    337.5,
    343.75,
    350.0,
    356.25,
    362.5,
    368.75,
    375.0,
    381.25,
    387.5,
    393.75,
    400.0,
    406.25,
    412.5,
    418.75,
    425.0,
    431.25,
    437.5,
    443.75,
    450.0,
    456.25,
    462.5,
    468.75,
    475.0,
    481.25,
    487.5,
    493.75,
    500.0,
    506.25,
    512.5,
    518.75,
    525.0,
    531.25,
    537.5,
    543.75,
    550.0,
    556.25,
    562.5,
    568.75,
    575.0,
    581.25,
    587.5,
    593.75,
    600.0,
    606.25,
    612.5,
    618.75,
    625.0,
    631.25,
    637.5,
    643.75,
    650.0,
    656.25,
    662.5,
    668.75,
    675.0,
    681.25,
    687.5,
    693.75,
    700.0,
    706.25,
    712.5,
    718.75,
    725.0,
    731.25,
    737.5,
    743.75,
    750.0,
    756.25,
    762.5,
    768.75,
    775.0,
    781.25,
    787.5,
    793.75,
    800.0,
    806.25,
    812.5,
    818.75,
    825.0,
    831.25,
    837.5,
    843.75,
    850.0,
    856.25,
    862.5,
    868.75,
    875.0,
    881.25,
    887.5,
    893.75,
    900.0,
    906.25,
    912.5,
    918.75,
    925.0,
    931.25,
    937.5,
    943.75,
    950.0,
    956.25,
    962.5,
    968.75,
    975.0,
    981.25,
    987.5,
    993.75,
    1000.0,
    1006.25,
    1012.5,
    1018.75,
    1025.0,
    1031.25,
    1037.5,
    1043.75,
    1050.0,
    1056.25,
    1062.5,
    1068.75,
    1075.0,
    1081.25,
    1087.5,
    1093.75,
    1100.0,
    1106.25,
    1112.5,
    1118.75,
    1125.0,
    1131.25,
    1137.5,
    1143.75,
    1150.0,
    1156.25,
    1162.5,
    1168.75,
    1175.0,
    1181.25,
    1187.5,
    1193.75,
    1200.0
   ]
  },
  {
   "id": "F2",
   "name": "Fuel tank 2 (demo, trim)",
   "type": "fuel",
   "capacityGal": 600,
   "fillLimitPct": 90,
   "unpumpableGal": 10,
   "trimCorrected": true,
   "stepIn": 0.25,
   "maxIn": 24,
   "sumGroup": null,
   "gallons": [
    0.0,
    6.25,
    12.5,
    18.75,
    25.0,
    31.25,
    37.5,
    43.75,
    50.0,
    56.25,
    62.5,
    68.75,
    75.0,
    81.25,
    87.5,
    93.75,
    100.0,
    106.25,
    112.5,
    118.75,
    125.0,
    131.25,
    137.5,
    143.75,
    150.0,
    156.25,
    162.5,
    168.75,
    175.0,
    181.25,
    187.5,
    193.75,
    200.0,
    206.25,
    212.5,
    218.75,
    225.0,
    231.25,
    237.5,
    243.75,
    250.0,
    256.25,
    262.5,
    268.75,
    275.0,
    281.25,
    287.5,
    293.75,
    300.0,
    306.25,
    312.5,
    318.75,
    325.0,
    331.25,
    337.5,
    343.75,
    350.0,
    356.25,
    362.5,
    368.75,
    375.0,
    381.25,
    387.5,
    393.75,
    400.0,
    406.25,
    412.5,
    418.75,
    425.0,
    431.25,
    437.5,
    443.75,
    450.0,
    456.25,
    462.5,
    468.75,
    475.0,
    481.25,
    487.5,
    493.75,
    500.0,
    506.25,
    512.5,
    518.75,
    525.0,
    531.25,
    537.5,
    543.75,
    550.0,
    556.25,
    562.5,
    568.75,
    575.0,
    581.25,
    587.5,
    593.75,
    600.0
   ]
  },
  {
   "id": "W1",
   "name": "Waste oil (demo)",
   "type": "waste",
   "capacityGal": 200,
   "fillLimitPct": 95,
   "unpumpableGal": 0,
   "trimCorrected": false,
   "stepIn": 0.25,
   "maxIn": 20,
   "sumGroup": "sludgeRequest",
   "gallons": [
    0.0,
    2.5,
    5.0,
    7.5,
    10.0,
    12.5,
    15.0,
    17.5,
    20.0,
    22.5,
    25.0,
    27.5,
    30.0,
    32.5,
    35.0,
    37.5,
    40.0,
    42.5,
    45.0,
    47.5,
    50.0,
    52.5,
    55.0,
    57.5,
    60.0,
    62.5,
    65.0,
    67.5,
    70.0,
    72.5,
    75.0,
    77.5,
    80.0,
    82.5,
    85.0,
    87.5,
    90.0,
    92.5,
    95.0,
    97.5,
    100.0,
    102.5,
    105.0,
    107.5,
    110.0,
    112.5,
    115.0,
    117.5,
    120.0,
    122.5,
    125.0,
    127.5,
    130.0,
    132.5,
    135.0,
    137.5,
    140.0,
    142.5,
    145.0,
    147.5,
    150.0,
    152.5,
    155.0,
    157.5,
    160.0,
    162.5,
    165.0,
    167.5,
    170.0,
    172.5,
    175.0,
    177.5,
    180.0,
    182.5,
    185.0,
    187.5,
    190.0,
    192.5,
    195.0,
    197.5,
    200.0
   ]
  }
 ]
}